{
  "$schema": "https://json-schema.org/draft/2020-12/schema",
  "$id": "https://eclipse.dev/score/schemas/srac/0.2/srac-report.schema.json",
  "$comment": "SPDX-License-Identifier: Apache-2.0",
  "title": "Draft S-CORE SRAC enrichment report",
  "description": "Experimental report joining an SRAC assertion to an SBOM component. Safety fields are copied from the assertion and are not independently assessed by the generator.",
  "type": "object",
  "additionalProperties": false,
  "required": [
    "schemaVersion",
    "sourceFormat",
    "assertionId",
    "subject",
    "safetyAssessment",
    "matchedComponents",
    "matchStatus",
    "generator",
    "integrity"
  ],
  "properties": {
    "schemaVersion": {"const": "0.2-draft"},
    "sourceFormat": {"enum": ["SPDX", "CycloneDX"]},
    "assertionId": {"type": "string", "minLength": 1},
    "subject": {"type": "object"},
    "safetyAssessment": {
      "type": "object",
      "additionalProperties": false,
      "required": ["source", "safetyRelevance", "classification", "assertionStatus", "reviewer"],
      "properties": {
        "source": {"const": "assertion"},
        "safetyRelevance": {
          "description": "Functional-safety relevance only. Security relevance is represented independently by impactLevel and SBOM/VEX security data.",
          "enum": ["safety-related", "not-safety-related", "undetermined"]
        },
        "classification": {
          "description": "Portable classification copied from the assertion. The S-CORE needs.json exporter emits only QM, ASIL-B, ASIL-D and not-assigned. When impactAnalysis.safetyIntegrityLevel is present, the validator requires its equivalent SPDX vocabulary value.",
          "enum": ["QM", "ASIL-A", "ASIL-B", "ASIL-C", "ASIL-D", "not-assigned"]
        },
        "assertionStatus": {"enum": ["draft", "under-review", "reviewed", "approved", "superseded", "withdrawn"]},
        "reviewer": {
          "anyOf": [
            {"type": "null"},
            {
              "type": "object",
              "required": ["name"],
              "properties": {
                "name": {"type": "string", "minLength": 1},
                "uri": {"type": "string", "format": "uri"}
              }
            }
          ]
        }
      }
    },
    "impactAnalysis": {
      "type": "array",
      "items": {"$ref": "#/$defs/impactAnalysis"}
    },
    "sourceOfTruth": {"$ref": "#/$defs/sourceOfTruth"},
    "discoveredReference": {"$ref": "#/$defs/discoveredReference"},
    "matchedComponents": {
      "type": "array",
      "items": {
        "type": "object",
        "required": ["format", "identifier", "name", "version", "purl"],
        "properties": {
          "format": {"type": "string", "minLength": 1},
          "identifier": {"type": ["string", "null"]},
          "name": {"type": ["string", "null"]},
          "version": {"type": ["string", "null"]},
          "purl": {"type": "string", "pattern": "^pkg:"}
        }
      }
    },
    "matchStatus": {"enum": ["matched", "unmatched"]},
    "bindingEvidence": {
      "type": "object",
      "required": ["strategy", "module", "repository", "hash"],
      "properties": {
        "strategy": {"const": "score-known-good"},
        "module": {"type": "string", "minLength": 1},
        "repository": {"type": "string", "format": "uri"},
        "hash": {"type": "string", "pattern": "^[0-9a-fA-F]{40}$"}
      }
    },
    "generator": {
      "type": "object",
      "additionalProperties": false,
      "required": ["name", "version"],
      "properties": {
        "name": {"const": "srac.tools.enrich_sbom"},
        "version": {"type": "string", "minLength": 1}
      }
    },
    "integrity": {
      "type": "object",
      "additionalProperties": false,
      "required": ["algorithm", "assertionSha256", "sbomSha256"],
      "properties": {
        "algorithm": {"const": "SHA-256"},
        "assertionSha256": {"type": "string", "pattern": "^[0-9a-f]{64}$"},
        "sbomSha256": {"type": "string", "pattern": "^[0-9a-f]{64}$"},
        "knownGoodSha256": {"type": "string", "pattern": "^[0-9a-f]{64}$"}
      }
    }
  },
  "$defs": {
    "discoveredReference": {
      "type": "object",
      "additionalProperties": false,
      "required": ["format", "componentIdentifier", "uri", "sha256"],
      "properties": {
        "format": {"enum": ["SPDX", "CycloneDX"]},
        "componentIdentifier": {"type": "string", "minLength": 1},
        "uri": {"type": "string", "format": "uri-reference"},
        "sha256": {"type": "string", "pattern": "^[0-9a-f]{64}$"}
      }
    },
    "sourceOfTruth": {
      "type": "object",
      "additionalProperties": false,
      "required": [
        "system",
        "documentUri",
        "version",
        "rootElement",
        "rootElementType",
        "rootElementStatus",
        "includedElements",
        "sha256"
      ],
      "properties": {
        "system": {"const": "sphinx-needs"},
        "documentUri": {"type": "string", "format": "uri"},
        "version": {"type": "string", "minLength": 1},
        "rootElement": {"type": "string", "minLength": 1},
        "rootElementType": {"type": "string", "minLength": 1},
        "rootElementStatus": {"type": "string", "minLength": 1},
        "includedElements": {
          "type": "array",
          "items": {"type": "string", "minLength": 1},
          "uniqueItems": true
        },
        "sha256": {"type": "string", "pattern": "^[0-9a-f]{64}$"}
      }
    },
    "party": {
      "type": "object",
      "additionalProperties": false,
      "required": ["name"],
      "properties": {
        "name": {"type": "string", "minLength": 1},
        "uri": {"type": "string", "format": "uri"}
      }
    },
    "elementIdentifiers": {
      "type": "array",
      "items": {"type": "string", "minLength": 1},
      "uniqueItems": true
    },
    "impactAnalysis": {
      "type": "object",
      "additionalProperties": false,
      "required": [
        "id",
        "trigger",
        "impactAnalysisStatus",
        "impactedElement",
        "addedElement",
        "modifiedElement",
        "removedElement",
        "decisions"
      ],
      "properties": {
        "id": {"type": "string", "minLength": 1},
        "trigger": {
          "type": "object",
          "additionalProperties": false,
          "required": ["type", "uri"],
          "properties": {
            "id": {"type": "string", "minLength": 1},
            "type": {"type": "string", "minLength": 1},
            "uri": {"type": "string", "format": "uri"}
          }
        },
        "impactAnalysisStatus": {
          "enum": ["new", "inProgress", "complete", "stopped", "duplicate", "other"]
        },
        "impactLevel": {
          "enum": [
            "noCriticalImpact",
            "safetyImpact",
            "securityImpact",
            "safetyAndSecurityImpact",
            "qualityImpact",
            "availabilityImpact",
            "customerSatisfactionImpact",
            "other"
          ]
        },
        "safetyIntegrityLevel": {
          "description": "Portable SPDX SafetyIntegrityLevelType spelling of safetyAssessment.classification; both values must be equivalent. SIL and DAL are retained for SPDX alignment but are not emitted by the S-CORE needs.json exporter.",
          "enum": [
            "qm",
            "asilA",
            "asilB",
            "asilC",
            "asilD",
            "sil1",
            "sil2",
            "sil3",
            "sil4",
            "dalA",
            "dalB",
            "dalC",
            "dalD",
            "dalE",
            "other",
            "noAssertion"
          ]
        },
        "impactAnalysisProcess": {
          "type": "object",
          "additionalProperties": false,
          "required": ["uri"],
          "properties": {"uri": {"type": "string", "format": "uri"}}
        },
        "rationale": {"type": "string", "minLength": 1},
        "impactedElement": {"$ref": "#/$defs/elementIdentifiers"},
        "addedElement": {"$ref": "#/$defs/elementIdentifiers"},
        "modifiedElement": {"$ref": "#/$defs/elementIdentifiers"},
        "removedElement": {"$ref": "#/$defs/elementIdentifiers"},
        "decisions": {
          "type": "array",
          "items": {"$ref": "#/$defs/decision"}
        },
        "requirementVerification": {
          "type": "array",
          "items": {"$ref": "#/$defs/requirementVerification"}
        },
        "bundle": {"$ref": "#/$defs/bundle"}
      }
    },
    "decision": {
      "type": "object",
      "additionalProperties": false,
      "required": ["decisionType", "decisionStatus", "appliesTo", "originatedBy", "rationale"],
      "properties": {
        "id": {"type": "string", "minLength": 1},
        "decisionType": {
          "enum": [
            "approve",
            "approveConditionally",
            "reject",
            "defer",
            "delegate",
            "requestChange",
            "requestInformation",
            "noAction",
            "close",
            "duplicate",
            "other"
          ]
        },
        "decisionStatus": {
          "enum": ["proposed", "requested", "inProgress", "recorded", "superseded", "withdrawn", "enteredInError", "other"]
        },
        "appliesTo": {
          "type": "array",
          "minItems": 1,
          "items": {"type": "string", "minLength": 1},
          "uniqueItems": true
        },
        "originatedBy": {
          "anyOf": [{"$ref": "#/$defs/party"}, {"type": "null"}]
        },
        "rationale": {"type": "string", "minLength": 1}
      }
    },
    "requirementVerification": {
      "type": "object",
      "additionalProperties": false,
      "required": ["id", "verifies", "evidence"],
      "properties": {
        "id": {"type": "string", "minLength": 1},
        "verifies": {
          "type": "array",
          "minItems": 1,
          "items": {"type": "string", "minLength": 1},
          "uniqueItems": true
        },
        "evidence": {
          "type": "array",
          "items": {"type": "string", "minLength": 1},
          "uniqueItems": true
        },
        "rationale": {"type": "string", "minLength": 1}
      }
    },
    "bundle": {
      "type": "object",
      "additionalProperties": false,
      "required": ["id", "rootElement"],
      "properties": {
        "id": {"type": "string", "minLength": 1},
        "rootElement": {
          "type": "array",
          "minItems": 1,
          "items": {"type": "string", "minLength": 1},
          "uniqueItems": true
        }
      }
    }
  }
}
