{
  "schemaVersion": "0.2-draft",
  "sourceFormat": "SPDX",
  "assertionId": "srac-score-persistency-kvs-9ae529ba-draft-001",
  "subject": {
    "name": "score_persistency::kvs",
    "purl": "pkg:github/eclipse-score/persistency@9ae529ba9f413976ff5c9948c6490afa51bbfdc3#score/kvs",
    "version": "9ae529ba9f413976ff5c9948c6490afa51bbfdc3",
    "repository": "https://github.com/eclipse-score/persistency",
    "componentPath": "score/kvs"
  },
  "safetyAssessment": {
    "source": "assertion",
    "safetyRelevance": "undetermined",
    "classification": "not-assigned",
    "assertionStatus": "draft",
    "reviewer": null
  },
  "matchedComponents": [
    {
      "format": "SPDX-2.3",
      "identifier": "SPDXRef-score-persistency-unknown",
      "name": "score_persistency",
      "version": "unknown",
      "purl": "pkg:github/eclipse-score/score_persistency@unknown"
    }
  ],
  "matchStatus": "matched",
  "generator": {
    "name": "srac.tools.enrich_sbom",
    "version": "0.2.0-draft"
  },
  "integrity": {
    "algorithm": "SHA-256",
    "assertionSha256": "a00f1b98762fa848d00d3c9718f9a219b710fdf019d435f51d75fdd0d7993c56",
    "sbomSha256": "e147f5db23d35c97c8c779c217d6edb9977d01cddf7683e2c46d45cf09737243",
    "knownGoodSha256": "c9fb107684a721e36f1f4a94f34da862955c88b0b519843cd8c5db8814fe36d4"
  },
  "bindingEvidence": {
    "strategy": "score-known-good",
    "module": "score_persistency",
    "repository": "https://github.com/eclipse-score/persistency.git",
    "hash": "9ae529ba9f413976ff5c9948c6490afa51bbfdc3"
  }
}
